{
  "$schema": "./registro-fonti.schema.json",
  "schema_version": "1.0",
  "updated_at": "2026-09-28",
  "next_id_by_year": {
    "2026": 25
  },
  "sources": [
    {
      "id": "SRC-2026-0001",
      "status": "approved",
      "level": "A",
      "type": "standard_or_specification",
      "title": "Calcolo FIRE Italia — specifica matematica del motore",
      "responsible_entity": "Calcolo FIRE Italia",
      "authors": [
        "Stefano Liga"
      ],
      "url": "https://github.com/stefanoliga1990-ui/calcolatorefire/blob/main/docs/specifica-matematica.md",
      "persistent_identifier": "cfc3fc4feab57fb12696b48c45a82bb5b371bc03",
      "dates": {
        "published": null,
        "updated": "2026-09-23",
        "first_accessed_at": "2026-09-24T17:47:02+02:00",
        "last_accessed_at": "2026-09-28T17:03:55+02:00"
      },
      "applicability": {
        "valid_from": null,
        "valid_to": null,
        "as_of": "2026-09-28",
        "reference_period": "Versione del motore verificata su main",
        "version": "cfc3fc4feab57fb12696b48c45a82bb5b371bc03",
        "provisional": false
      },
      "locator": {
        "article": null,
        "section": "GUIDE-0021: documento completo nel checkout main, sezioni2-4,6,8-9,17-18; FireCalculator.initialContribution e FiscalAccumulationPlan.growingPac, FiscalFireCalculator e campo annualContributionGrowthRate nel frontend; confronto Python/JShell. GUIDE-0022: documenti completi; matematica2-3,6-9,11,17,19-22; fiscalita7,14-16; formule Python e FiscalFireCalculator via JShell. GUIDE-0023: Documentazione integrale; sezioni2-9,16-23; formule Python e FiscalFireCalculator.calculate via JShell. GUIDE-0024: Documento completo nel checkout main; sezioni2-8,16-18,21.4,23; FiscalFireCalculator.calculate; formule Python e verifiche JShell. GUIDE-0025: documento originale completo nel checkout main; sezioni2-10,16-24; frontend app-91e2b4c7a630.js renderAccumulationChart/renderDecumulationChart e index.html Le proiezioni; FiscalFireCalculator.calculate; verifica Python e JShell.",
        "page": null,
        "table_or_figure": null,
        "dataset_or_series": null
      },
      "verification": {
        "checked_at": "2026-09-28T17:03:55+02:00",
        "checked_by": "automation",
        "full_content_accessed": true,
        "original_source_checked": true
      },
      "usages": [
        {
          "content_id": "METH-0001",
          "claim": "Convenzioni temporali, conversione dei tassi, target FINITE e SWR, PAC, risorse aggiuntive e proiezioni del simulatore.",
          "importance": "central",
          "verified_at": "2026-09-24T17:47:02+02:00"
        },
        {
          "content_id": "GUIDE-0001",
          "claim": "Differenza fra target FINITE e SWR, rivalutazione della spesa, proiezione del capitale e limiti deterministici del simulatore.",
          "importance": "central",
          "verified_at": "2026-09-24T21:05:22+02:00"
        },
        {
          "content_id": "GUIDE-0002",
          "claim": "Target FINITE e SWR, spesa alla data FIRE, ipotesi mensili e segnalazione dello shortfall.",
          "importance": "central",
          "verified_at": "2026-09-25T12:41:13+02:00"
        },
        {
          "content_id": "GUIDE-0003",
          "claim": "Nel metodo SWR il primo fabbisogno annuo diviso per il tasso scelto determina il target base; la proiezione mensile può segnalare uno shortfall.",
          "importance": "central",
          "verified_at": "2026-09-25T19:13:38+02:00"
        },
        {
          "content_id": "GUIDE-0004",
          "claim": "Il PAC iniziale dipende da target, patrimonio presente, mesi, rendimento di accumulo e crescita dei versamenti; i contributi entrano a fine mese.",
          "importance": "central",
          "verified_at": "2026-09-25T22:57:33+02:00"
        },
        {
          "content_id": "GUIDE-0005",
          "claim": "Il motore converte i tassi annui in equivalenti mensili, rivaluta la spesa fino al FIRE e usa il rapporto esatto tra rendimento nominale e inflazione per il rendimento reale.",
          "importance": "central",
          "verified_at": "2026-09-26T12:03:21+02:00"
        },
        {
          "content_id": "GUIDE-0007",
          "claim": "Il motore distingue investimento o PAC esistente, rendita periodica e capitale futuro; ne applica decorrenza, disponibilità, trattamento nel target e regole contro il doppio conteggio.",
          "importance": "central",
          "verified_at": "2026-09-26T18:03:35+02:00"
        },
        {
          "content_id": "GUIDE-0008",
          "claim": "FINITE usa durata, rendimento reale e capitale finale in una rendita anticipata; SWR divide il primo fabbisogno annuo per il tasso scelto e verifica poi gli eventuali shortfall nella proiezione. Le risorse aggiuntive seguono formule distinte.",
          "importance": "central",
          "verified_at": "2026-09-26T21:04:27+02:00"
        },
        {
          "content_id": "GUIDE-0009",
          "claim": "Il simulatore usa la spesa mensile in euro di oggi, la rivaluta fino al FIRE secondo l’inflazione ipotizzata e ne ricava il primo prelievo e il target del metodo selezionato.",
          "importance": "central",
          "verified_at": "2026-09-27T00:05:50+02:00"
        },
        {
          "content_id": "GUIDE-0010",
          "claim": "La specifica definisce target FIRE, mesi di accumulo, valore futuro del capitale e PAC iniziale; a target e altre ipotesi invariati, un versamento maggiore riduce il tempo necessario nel confronto di scenari.",
          "importance": "central",
          "verified_at": "2026-09-27T15:40:39+02:00"
        },
        {
          "content_id": "GUIDE-0011",
          "claim": "Il patrimonio principale e gli investimenti esistenti sono additivi; il PAC storico è nel saldo iniziale, i nuovi versamenti entrano a fine mese e solo le risorse disponibili al FIRE riducono il PAC aggiuntivo.",
          "importance": "central",
          "verified_at": "2026-09-27T17:42:44+02:00"
        },
        {
          "content_id": "GUIDE-0012",
          "claim": "Il motore applica un rendimento costante convertito su base mensile e prelievi a inizio mese; non simula sequenze di rendimenti variabili, Monte Carlo o probabilità di successo.",
          "importance": "central",
          "verified_at": "2026-09-27T19:44:18+02:00"
        },
        {
          "content_id": "GUIDE-0013",
          "claim": "Le sezioni 3-5 definiscono input nominali, conversione annua-mensile e rapporto esatto tra rendimento nominale e inflazione; le sezioni 6, 8 e 9 mostrano dove entrano nel target e nelle proiezioni.",
          "importance": "central",
          "verified_at": "2026-09-27T21:43:19+02:00"
        },
        {
          "content_id": "GUIDE-0014",
          "claim": "I rendimenti di accumulo e FIRE sono tassi nominali annui effettivi al netto dei costi ricorrenti e prima delle imposte personali; il motore usa tassi costanti e il rendimento di accumulo influenza il PAC, mentre quello FIRE influenza FINITE e la proiezione.",
          "importance": "central",
          "verified_at": "2026-09-27T23:44:05+02:00"
        },
        {
          "content_id": "GUIDE-0017",
          "claim": "Sezioni 17, 19–22 e 24.3: rendita netta disponibile dalla decorrenza; fabbisogno residuo, ricorrenza del ponte, riserva del regime stabile e minimo con il target base; esempi propri con spesa 2.200 euro, rendita 1.400 euro dopo 144 mesi e confronto FINITE su 480 mesi.",
          "importance": "central",
          "verified_at": "2026-09-28T03:49:03+00:00"
        },
        {
          "content_id": "GUIDE-0018",
          "claim": "Sezioni 16-23: importo netto in euro di oggi, intervallo iniziale incluso e finale escluso, crescita dal mese zero, rendita reinvestita a fine mese, riduzione del fabbisogno FIRE, eccedenza esclusa e differenza tra FINITE e SWR; esempi propri e reinvestimento parziale tramite due flussi disgiunti.",
          "importance": "central",
          "verified_at": "2026-09-28T07:49:19+02:00"
        },
        {
          "content_id": "GUIDE-0019",
          "claim": "GUIDE-0019: TODAY rivalutato all’incasso e NOMINAL fisso; somma disponibile al confine di ricezione; rendimento proprio solo fino al FIRE; entro FIRE riduce Gap / PAC, durante FIRE prima del prelievo, al confine finale dopo ultimo rendimento. Esempi propri verificati via JShell con motore fiscale entro 0,01 euro: età 40 → 50, FIRE 20 anni, spesa 1500 euro, capitale iniziale e terminale zero, altre risorse assenti, tassi e fiscalità zero. FINITE senza somma target 360000 / PAC 3000; 60000 a 45 o 50 target 360000 / PAC 2500; a 55 target 300000 / PAC 2500; 400000 a 55 target 90000 / PAC 750 / finale 130000. SWR 4%: 60000 a 50 target 450000 / PAC 3250; a 55 min(450000,90000+450000-60000) = 450000 / PAC 3750. Arrotondamento tabella all’euro. Con inflazione 2% ipotetica, 60000 TODAY fra 10 anni = 73139,67 nominali; 60000 NOMINAL = 49220,90 oggi. 60000 ricevuti a 45 investiti al 3% fino 50 = 69556,44 prima di fiscalità.",
          "importance": "central",
          "verified_at": "2026-09-28T07:50:42+00:00"
        },
        {
          "content_id": "GUIDE-0020",